{
  "$schema": "./data-plane.schema.json",
  "suite": "moqt-data-plane-vectors",
  "suite_revision": 1,
  "schema_digest": "sha256:5f26275592e7d0c80ecba9e85d89716a7902f566538bf80438afe3ea1725c97c",
  "target_draft": "draft-18",
  "normative_source": {
    "document": "draft-ietf-moq-transport-18",
    "sha": "cb2e772fd8ca8cbe7550b1765c269be89fb1c886",
    "url": "https://github.com/moq-wg/moq-transport/blob/cb2e772fd8ca8cbe7550b1765c269be89fb1c886/draft-ietf-moq-transport.md"
  },
  "common": {
    "namespace_fields": ["moq-interop", "{test_id}"],
    "track_name": "{run_id}",
    "run_id_pattern": "^[0-9a-f]{32}$",
    "run_id_generation": "cryptographically-secure-random-128-bit",
    "object_rules": {
      "status": "normal",
      "forwarding_preference": "subgroup",
      "end_of_group_markers": false,
      "datagrams": false,
      "fetch": false,
      "payload_byte_ascii": "t",
      "first_emitted_in_group_length": 16,
      "other_object_length": 8,
      "even_group_publisher_priority": 200,
      "odd_group_publisher_priority": 201,
      "fixture_cadence_ms": 10,
      "arrival_timing_assertion": false
    }
  },
  "tests": [
    {
      "id": "subscribe-one-subgroup-per-group",
      "revision": 1,
      "vector_digest": "sha256:65e949a67a9cb0bd41e0c85f2143f01cf304999f3f23a191ddd09ee51bca65a4",
      "objects": [
        {
          "fixture_emit_at_ms": 0,
          "group_id": 0,
          "subgroup_id": 0,
          "object_id": 0,
          "publisher_priority": 200,
          "status": "normal",
          "forwarding_preference": "subgroup",
          "payload_length": 16,
          "payload_ascii": "tttttttttttttttt",
          "properties": []
        },
        {
          "fixture_emit_at_ms": 10,
          "group_id": 0,
          "subgroup_id": 0,
          "object_id": 1,
          "publisher_priority": 200,
          "status": "normal",
          "forwarding_preference": "subgroup",
          "payload_length": 8,
          "payload_ascii": "tttttttt",
          "properties": []
        },
        {
          "fixture_emit_at_ms": 20,
          "group_id": 0,
          "subgroup_id": 0,
          "object_id": 2,
          "publisher_priority": 200,
          "status": "normal",
          "forwarding_preference": "subgroup",
          "payload_length": 8,
          "payload_ascii": "tttttttt",
          "properties": []
        },
        {
          "fixture_emit_at_ms": 30,
          "group_id": 1,
          "subgroup_id": 0,
          "object_id": 0,
          "publisher_priority": 201,
          "status": "normal",
          "forwarding_preference": "subgroup",
          "payload_length": 16,
          "payload_ascii": "tttttttttttttttt",
          "properties": []
        },
        {
          "fixture_emit_at_ms": 40,
          "group_id": 1,
          "subgroup_id": 0,
          "object_id": 1,
          "publisher_priority": 201,
          "status": "normal",
          "forwarding_preference": "subgroup",
          "payload_length": 8,
          "payload_ascii": "tttttttt",
          "properties": []
        },
        {
          "fixture_emit_at_ms": 50,
          "group_id": 1,
          "subgroup_id": 0,
          "object_id": 2,
          "publisher_priority": 201,
          "status": "normal",
          "forwarding_preference": "subgroup",
          "payload_length": 8,
          "payload_ascii": "tttttttt",
          "properties": []
        }
      ],
      "termination": {
        "subgroup_streams": [
          {"group_id": 0, "subgroup_id": 0, "first_object": true, "end_of_group": false, "final_object_id": 2, "terminal": "FIN"},
          {"group_id": 1, "subgroup_id": 0, "first_object": true, "end_of_group": false, "final_object_id": 2, "terminal": "FIN"}
        ],
        "publish_done": {"status": "TRACK_ENDED", "stream_count": 2, "publisher_reason": ""},
        "request_stream_terminal": "FIN"
      }
    },
    {
      "id": "subscribe-one-subgroup-per-object",
      "revision": 1,
      "vector_digest": "sha256:08703328960b48180e589917899c84c22a495283aa2910832fbcf8a05f8a8737",
      "objects": [
        {
          "fixture_emit_at_ms": 0,
          "group_id": 0,
          "subgroup_id": 0,
          "object_id": 0,
          "publisher_priority": 200,
          "status": "normal",
          "forwarding_preference": "subgroup",
          "payload_length": 16,
          "payload_ascii": "tttttttttttttttt",
          "properties": []
        },
        {
          "fixture_emit_at_ms": 10,
          "group_id": 0,
          "subgroup_id": 1,
          "object_id": 1,
          "publisher_priority": 200,
          "status": "normal",
          "forwarding_preference": "subgroup",
          "payload_length": 8,
          "payload_ascii": "tttttttt",
          "properties": []
        },
        {
          "fixture_emit_at_ms": 20,
          "group_id": 0,
          "subgroup_id": 2,
          "object_id": 2,
          "publisher_priority": 200,
          "status": "normal",
          "forwarding_preference": "subgroup",
          "payload_length": 8,
          "payload_ascii": "tttttttt",
          "properties": []
        }
      ],
      "termination": {
        "subgroup_streams": [
          {"group_id": 0, "subgroup_id": 0, "first_object": true, "end_of_group": false, "final_object_id": 0, "terminal": "FIN"},
          {"group_id": 0, "subgroup_id": 1, "first_object": true, "end_of_group": false, "final_object_id": 1, "terminal": "FIN"},
          {"group_id": 0, "subgroup_id": 2, "first_object": true, "end_of_group": false, "final_object_id": 2, "terminal": "FIN"}
        ],
        "publish_done": {"status": "TRACK_ENDED", "stream_count": 3, "publisher_reason": ""},
        "request_stream_terminal": "FIN"
      }
    },
    {
      "id": "subscribe-two-subgroups-per-group",
      "revision": 1,
      "vector_digest": "sha256:cd5c94caf2a0cb83d7cd931c0cc8854d7bdd44308604d4019c64657899e6f8fc",
      "objects": [
        {
          "fixture_emit_at_ms": 0,
          "group_id": 0,
          "subgroup_id": 0,
          "object_id": 0,
          "publisher_priority": 200,
          "status": "normal",
          "forwarding_preference": "subgroup",
          "payload_length": 16,
          "payload_ascii": "tttttttttttttttt",
          "properties": []
        },
        {
          "fixture_emit_at_ms": 10,
          "group_id": 0,
          "subgroup_id": 1,
          "object_id": 1,
          "publisher_priority": 200,
          "status": "normal",
          "forwarding_preference": "subgroup",
          "payload_length": 8,
          "payload_ascii": "tttttttt",
          "properties": []
        },
        {
          "fixture_emit_at_ms": 20,
          "group_id": 0,
          "subgroup_id": 0,
          "object_id": 2,
          "publisher_priority": 200,
          "status": "normal",
          "forwarding_preference": "subgroup",
          "payload_length": 8,
          "payload_ascii": "tttttttt",
          "properties": []
        },
        {
          "fixture_emit_at_ms": 30,
          "group_id": 0,
          "subgroup_id": 1,
          "object_id": 3,
          "publisher_priority": 200,
          "status": "normal",
          "forwarding_preference": "subgroup",
          "payload_length": 8,
          "payload_ascii": "tttttttt",
          "properties": []
        },
        {
          "fixture_emit_at_ms": 40,
          "group_id": 0,
          "subgroup_id": 0,
          "object_id": 4,
          "publisher_priority": 200,
          "status": "normal",
          "forwarding_preference": "subgroup",
          "payload_length": 8,
          "payload_ascii": "tttttttt",
          "properties": []
        },
        {
          "fixture_emit_at_ms": 50,
          "group_id": 0,
          "subgroup_id": 1,
          "object_id": 5,
          "publisher_priority": 200,
          "status": "normal",
          "forwarding_preference": "subgroup",
          "payload_length": 8,
          "payload_ascii": "tttttttt",
          "properties": []
        }
      ],
      "termination": {
        "subgroup_streams": [
          {"group_id": 0, "subgroup_id": 0, "first_object": true, "end_of_group": false, "final_object_id": 4, "terminal": "FIN"},
          {"group_id": 0, "subgroup_id": 1, "first_object": true, "end_of_group": false, "final_object_id": 5, "terminal": "FIN"}
        ],
        "publish_done": {"status": "TRACK_ENDED", "stream_count": 2, "publisher_reason": ""},
        "request_stream_terminal": "FIN"
      }
    },
    {
      "id": "subscribe-nonzero-start-group",
      "revision": 1,
      "vector_digest": "sha256:0d01656c263de0beb825293a495c13a4376a7c670af04141b39e87b1a44eccd9",
      "objects": [
        {
          "fixture_emit_at_ms": 0,
          "group_id": 5,
          "subgroup_id": 0,
          "object_id": 0,
          "publisher_priority": 201,
          "status": "normal",
          "forwarding_preference": "subgroup",
          "payload_length": 16,
          "payload_ascii": "tttttttttttttttt",
          "properties": []
        },
        {
          "fixture_emit_at_ms": 10,
          "group_id": 5,
          "subgroup_id": 0,
          "object_id": 1,
          "publisher_priority": 201,
          "status": "normal",
          "forwarding_preference": "subgroup",
          "payload_length": 8,
          "payload_ascii": "tttttttt",
          "properties": []
        },
        {
          "fixture_emit_at_ms": 20,
          "group_id": 6,
          "subgroup_id": 0,
          "object_id": 0,
          "publisher_priority": 200,
          "status": "normal",
          "forwarding_preference": "subgroup",
          "payload_length": 16,
          "payload_ascii": "tttttttttttttttt",
          "properties": []
        },
        {
          "fixture_emit_at_ms": 30,
          "group_id": 6,
          "subgroup_id": 0,
          "object_id": 1,
          "publisher_priority": 200,
          "status": "normal",